{
  "schemaVersion": "1.0",
  "id": "architecture.plugin-permission-model",
  "version": "1.0.0",
  "title": "Design a Plugin Permission Model",
  "category": "architecture",
  "difficulty": "senior",
  "runtime": {
    "language": "markdown",
    "framework": "n/a"
  },
  "limits": {
    "timeoutSeconds": 900,
    "maxInputTokens": 30000,
    "maxOutputTokens": 18000,
    "maxToolCalls": 80
  },
  "candidate": {
    "instructions": "prompt.md",
    "workspace": "starter"
  },
  "grading": {
    "command": "dotnet run --project grader/AgentInterview.Grader.csproj --",
    "passThreshold": 100,
    "maximumScore": 100
  },
  "networkAccess": false
}
