{
  "schemaVersion": "1.0",
  "id": "coding.calculator-api",
  "version": "1.0.0",
  "title": "Implement a Calculator API",
  "category": "coding",
  "difficulty": "mid",
  "runtime": {
    "language": "csharp",
    "framework": "net10.0"
  },
  "limits": {
    "timeoutSeconds": 900,
    "maxInputTokens": 25000,
    "maxOutputTokens": 15000,
    "maxToolCalls": 100
  },
  "candidate": {
    "instructions": "prompt.md",
    "workspace": "starter"
  },
  "grading": {
    "command": "dotnet test grader/AgentInterview.Grader.csproj",
    "passThreshold": 100,
    "maximumScore": 100
  },
  "networkAccess": false
}
